02/26/2019 20:48:00, "When you realize that someone in Pleasure sexually assaulted repeatedly while you were in a relationship with them..."
02/26/2019 20:47:00, "Hello, will someone please inform the Trader Joe's down Memorial Drive that they cannot continue to sell avocados for 99c, for if they do I will KEEP purchasing them and I will KEEP eating them and my lips with KEEP becoming very puffy due to my mild avocado allergy. Thank you in advance."
02/26/2019 20:47:00, "Ok MIT party scene has official peak saturation of hip hop / rap music. Need to get skullfucked at a party by EDM in at least the next week or two or there really isn’t a point in going to this school anymore"
02/26/2019 20:47:00, "no, sir, apparently chalk is NOT made of seeds, but thanks for prompting me to google that in the middle of lecture i learned a lot about calcium carbonate and also that maybe i should be course 3 instead of 18"
02/26/2019 20:46:00, "Positivity thread. I'll start: even though I didn't put much thought into applying here, I'm glad this is where I ended up. The challenge and the people I've met here make it all worth it."
02/26/2019 20:46:00, "shout out to the 16.405/6.141 TAs for sitting with my stupid ass for HOURS helping me debug code. youre the best and i tell my friends how great you are"
02/26/2019 20:45:00, "I am an Asian Canadian who is looking at the end of his time in Boston."Don’t really get why some of my friends are so keen on moving to SF after graduation.“Amenities” of SF include homeless guys throwing feces at you outside your $4k/m studio and the second highest male to female ratio of any major US City....See More
02/26/2019 20:45:00, "You want juicy? I once stole a chocolate bar from La Verdes."Then I went home and shoved the entire thing up my ass.
02/26/2019 20:45:00, "I found out capacitor juice tastes bitter, plus a burning sensation"
02/26/2019 20:43:00, "what the fuck kind of prof has office hours literally the hour after the pset is due and leaves the room immediately after lecture? Do they *want* to be inaccessible and unhelpful? I'm struggling already"1414Like
02/25/2019 23:34:00, "How tf can I use the pool and the sauna in the Z at the same session? Am I supposed to walk accross rockwell to Dupont and back dripping in my swimming suit, or is there a better way?"
02/25/2019 23:34:00, "I don't give a fuck Julie Zhang is objectively the hottest smartest girl at MIT. Please come to our party this weekend."
02/25/2019 23:33:00, "I think my neighbor just realized I’m trans as my voice has been dropping all year thanks to T. Today for the first time he said “madam—wait I mean. uh. ???? sorry???” "(Note the maam thing was part of a joke we don’t have that weird a roommate relationship)
02/25/2019 23:32:00, "Is Amir F single? Asking for a friend (actually, for once on this page)."
02/25/2019 23:32:00, "Born too late for Bexley LSD, born too early for College of Computing sex robots. Born just in time for the golden age of MIT Confessions (even though it's passed)."
02/25/2019 23:31:00, "Ngl, I miss my 中文课的 peng yous a lot </3"
02/25/2019 23:31:00, "Petition to use the college of computing tents for our tent parties."
02/25/2019 23:30:00, "So does your girlfriend know you've been trying to hit me up for the past 3 years or?"1515Like
02/25/2019 23:30:00, "Another juicy confession: I once sucked a guy's dick in the handicap shower that's in the lower-level bathroom in Stata. Yes, I am that trashy and horrible."
02/25/2019 23:30:00, "MCAT SCORES COME OUT TODAY."
02/25/2019 23:30:00, "Michael Birnbaum x1000"1717Like
02/25/2019 23:29:00, "@guy with the razer laptop this morning in stata...holy SHIT you type fast. if what looked like your terminal work is any indication, you’d be a freaking piano god or something wowzers"
02/25/2019 23:28:00, "Mikael is the most wholesome guy I know, get you a friend like Mikael Nida"
02/25/2019 23:28:00, "You are really awsome. I love how passionate you are about teaching, and I think you'll do a great job. Not only are you crazy smart, but you also got that nerdy professor with a sense of humor vibe, which is really cool. Keep being great <3"
02/25/2019 23:27:00, "Y'all want a juicy confession? I stayed home over IAP and in my horny boredom, I made the great decision to hookup with a 45 year old guy at a Hotel 6 and smoke crack. Somehow, I didn't catch anything."
02/25/2019 23:27:00, "Shoutout to Zack Remscrim and Svetlana for somehow getting me to understand 18.06. Ta award of the year"
02/25/2019 23:27:00, "Apparently the Mayans made hot pockets and we have archeological evidence."Source: 3.985
02/25/2019 23:26:00, "What do u mean by situational?"
02/25/2019 23:25:00, "I just did an entire 6.042 question without wanting to cry i’m so proud of myself is this what learning feels like"
02/25/2019 23:25:00, "where's everyone gonna be (semi-permanently) post graduation???!!!"Like for east coastHeart for west coastHaha for midwest coast...See More
02/25/2019 23:23:00, "MIT confessions will now have oppression, goodbye freedom of expression."
02/25/2019 23:22:00, "MIT memes admins are cancelled. unsub from T-series, subscribe to pewdiepie"
02/25/2019 23:21:00, "6.031 is a reading comprehension class #specs"Change my mind.
02/25/2019 23:20:00, "Such wholesome shoutouts at TKD tonight, I love you all <3"
02/25/2019 23:20:00, "A real gentleman jerks off in the shower a few hours before your netflix and chill sesh, just so he can last longer for you. My pussy and I thank you <3"
